{
  "schema_version": "1.0",
  "run_id": "00000000-0000-4000-8000-000000000001",
  "approval_id": "00000000-0000-4000-8000-000000000002",
  "spec_sha256": "aaaaaaaaaaaaaaaaaaaaaaaaaaaaaaaaaaaaaaaaaaaaaaaaaaaaaaaaaaaaaaaa",
  "requirements_sha256": "bbbbbbbbbbbbbbbbbbbbbbbbbbbbbbbbbbbbbbbbbbbbbbbbbbbbbbbbbbbbbbbb",
  "scope_sha256": "cccccccccccccccccccccccccccccccccccccccccccccccccccccccccccccccc",
  "target_profile": "fixture",
  "limits": {
    "step_timeout_ms": 5000,
    "navigation_timeout_ms": 10000,
    "case_timeout_ms": 60000,
    "max_requests": 100,
    "max_response_bytes": 10485760
  },
  "test_case": {
    "schema_version": "1.0",
    "case_id": "00000000-0000-4000-8000-000000000001",
    "revision_id": "00000000-0000-4000-8000-000000000002",
    "title": "Required email blocks empty submission",
    "goal": "Verify required email feedback",
    "category": "form_validation",
    "discovery_snapshot_id": "00000000-0000-4000-8000-000000000003",
    "target_origin": "http://127.0.0.1:8080",
    "requirement_revision_ids": [
      "00000000-0000-4000-8000-000000000004"
    ],
    "preconditions": [
      "Fresh controlled fixture page"
    ],
    "steps": [
      {
        "id": "s1",
        "action": "navigate",
        "path": "/"
      },
      {
        "id": "s2",
        "action": "submit",
        "locator": {
          "kind": "element_id",
          "element_id": "signup"
        }
      },
      {
        "id": "s3",
        "assertion": "text",
        "locator": {
          "kind": "element_id",
          "element_id": "signup-status"
        },
        "expected": "Email is required"
      }
    ],
    "expected_outcome": "Email is required",
    "risk": "low"
  }
}
